Código Produto,Nome Produto,Marca,Modelo,Tipo,Indice,Tratamento,Antireflexo,Variação Antireflexo
208323,LENTES SOL RAY BAN,RAY BAN,SOL,VISÃO SIMPLES,1.50,,AR,
461966,LENTES SOL EMPORIO ARMANI RAJ7427AA RC002,EMPORIO ARMANI,SOL,VISÃO SIMPLES,1.50,,AR,
510604,LENTES SOL RAY BAN RB3522AB RC002AB,RAY BAN,SOL,VISÃO SIMPLES,1.50,,AR,
641373,LENTES SOL OAKLEY OO9263AB 1892AA,OAKLEY,SOL,VISÃO SIMPLES,1.50,,ANTIRRISCO,
707766,LENTES SOL RAY BAN RAM5200AB RC004AA,RAY BAN,SOL,VISÃO SIMPLES,1.50,,AR,
960016,LENTES SOL RAY BAN ZRB3605N3590,RAY BAN,SOL,VISÃO SIMPLES,1.50,,ANTIRRISCO,
962041,LENTES RAY BAN ZRB21803061661349,RAY BAN,,PROGRESSIVA,1.59,,AR,
990397,LENTES RAY BAN ZRB353830186-7153,RAY BAN,,VISÃO SIMPLES,1.50,,AR,
990400,LENTES PAR RAY BAN ZRB4165L30852-8854,RAY BAN,,VISÃO SIMPLES,1.50,,AR,
991164,LENTES RAY BAN ZRB3025L30W323455,RAY BAN,,PROGRESSIVA,1.59,,AR,
BF0501,BIF. EXECUTIVE CR-39 INC,EXECUTIVE,,BIFOCAL,1.50,,ANTIRRISCO,
BF0502,BIF. EXECUTIVE CR-39 INC. AR,EXECUTIVE,,BIFOCAL,1.50,,AR,
BF0509,BIF. FLAT TOP CR-39 INC,FLAT TOP,,BIFOCAL,1.50,,ANTIRRISCO,
BF0510,BIF. FLAT TOP CR-39 INC. AR,FLAT TOP,,BIFOCAL,1.50,,AR,
BF0513,BIF. FLAT TOP CR-39 COLOR,FLAT TOP,,BIFOCAL,1.50,,ANTIRRISCO,
BF0517,BIF. FLAT TOP CR-39 TRANS CINZA,FLAT TOP,,BIFOCAL,1.50,TRANSITIONS,ANTIRRISCO,
BF0518,BIF. FLAT TOP CR-39 TRANS CINZA AR,FLAT TOP,,BIFOCAL,1.50,TRANSITIONS,AR,
BF0524,BIF. FLAT TOP POLI INC.BIF. FLAT TOP POLI INC,FLAT TOP,,BIFOCAL,1.59,,ANTIRRISCO,
BF0525,BIF. FLAT TOP POLI INC. AR(INATIVO),FLAT TOP,,BIFOCAL,1.59,,AR,
BF0532,BIF. FLAT TOP CRISTAL FOTO,FLAT TOP,,BIFOCAL,1.50,FOTO,ANTIRRISCO,
BF0534,BIF. KRIPTOK CR-39 INC.,KRIPTOK,,BIFOCAL,1.50,,ANTIRRISCO,
BF0535,BIF. KRIPTOK CR-39 INC. AR,KRIPTOK,,BIFOCAL,1.50,,AR,
BF0538,BIF. KRIPTOK CR-39 COLOR,KRIPTOK,,BIFOCAL,1.50,,ANTIRRISCO,
BF0542,BIF. KRIPTOK CRISTAL INC.,KRIPTOK,CRISTAL,BIFOCAL,1.50,,ANTIRRISCO,
BF0543,BIF. KRIPTOK CRISTAL INC. AR,KRIPTOK,CRISTAL,BIFOCAL,1.50,,AR,
BF0544,BIF. KRIPTOK CRISTAL FOTO,KRIPTOK,CRISTAL,BIFOCAL,1.50,FOTO,ANTIRRISCO,
BF0552,BIF. SOLEX CR-39 INC.,SOLEX,,BIFOCAL,1.50,,ANTIRRISCO,
BF0553,BIF. SOLEX CR-39 INC. AR,SOLEX,,BIFOCAL,1.50,,AR,
BF0556,BIF. SOLEX CR-39 COLOR,SOLEX,,BIFOCAL,1.50,,ANTIRRISCO,
BF0560,BIF. ULTEX CR-39 INC.,ULTEX,,BIFOCAL,1.50,,ANTIRRISCO,
BF0561,BIF. ULTEX CR-39 INC. AR,ULTEX,,BIFOCAL,1.50,,AR,
BF0569,BIF. ULTEX CR-39 TRANS CINZA AR,ULTEX,,BIFOCAL,1.50,TRANSITIONS,AR,
BF0581,BIF. BI-FREE HD CR-39 INC.,EXECUTIVE,,BIFOCAL,1.50,,ANTIRRISCO,
BF0680,BIF. BIFOCAL FOTO,FLAT TOP,,BIFOCAL,1.50,FOTO,ANTIRRISCO,
LP14597,LT PRONTA MIOLIGHT 1.67 BLUECONTROL,MIOLIGHT,,LENTE PRONTA,1.67,,BLUECONTROL,
LP14598,LT PRONTA HIPERLIGHT 1.67 BLUECONTROL,HIPERLIGHT,,LENTE PRONTA,1.67,,BLUECONTROL,
LP15304,LT PRONTA POLI FOTO,POLI,FOTO,LENTE PRONTA,1.59,FOTO,ANTIRRISCO,
LP15305,LT PRONTA POLI FOTO AR,POLI,FOTO AR,LENTE PRONTA,1.59,FOTO,AR,
LP15432,LT PRONTA ZEISS 1.60 ASP DRV BPROTECT UV Cil. ESTE,ZEISS,,LENTE PRONTA,1.60,,DURAVISION,BLUEPROTECT
LP1672,LP ZEISS 1.50 PFUSION CINZA  DURAVISION PLATINUM,ZEISS,,LENTE PRONTA,1.50,PHOTOFUSION,DURAVISION,PLATINUM
LP1674,LP ZEISS 1.50 DIGITAL SHIELD,ZEISS,,LENTE PRONTA,1.50,,ANTIRRISCO,
LP17058,LT PR ULTRAX CR-39 SENSITY 2 CLEANEXTRA,ULTRAX,,LENTE PRONTA,1.50,SENSITY,CLEANEXTRA,
LP17558,LT PRONTA 1.56 BLUE CUT AR,1.56,,LENTE PRONTA,1.56,,BLUE CUT,
LP17559,LT PRONTA POLI BLUE CUT AR,POLI,,LENTE PRONTA,1.59,,BLUE CUT,
LP17560,LT PRONTA 1.67 BLUE CUT AR,1.67,,LENTE PRONTA,1.67,,BLUE CUT,
LP17561,LT PRONTA ZEISS 1.50 INC CLEARVIEW DRV CHROME UV,ZEISS,,LENTE PRONTA,1.50,,DURAVISION,CHROME
LP17562,LP ZEISS 1.50 INC CLRVIEW DRV CHROME UV Cil. EST,ZEISS,,LENTE PRONTA,1.50,,DURAVISION,CHROME
LP17563,LT PRONTA ZEISS 1.50 INC CLEARVIEW DRV SILVER UV,ZEISS,,LENTE PRONTA,1.50,,DURAVISION,SILVER
LP17564,LP ZEISS 1.50 INC CLRVIEW DRV SILVER UV Cil. EST,ZEISS,,LENTE PRONTA,1.50,,DURAVISION,SILVER
LP17565,LT PRONTA ZEISS 1.50 INC CLEARVIEW DRV PLATINUM,ZEISS,,LENTE PRONTA,1.50,,DURAVISION,PLATINUM
LP17566,LP ZEISS 1.50 CLEARVIEW PFUSION CINZA DRV PLATIN,ZEISS,,LENTE PRONTA,1.50,PHOTOFUSION,DURAVISION,PLATINUM
LP17567,LT PRONTA ZEISS POLI INC CLEARVIEW DRV CHROME UV,ZEISS,,LENTE PRONTA,1.59,,DURAVISION,CHROME
LP17568,LT PRONTA ZEISS POLI INC CLEARVIEW DRV SILVER UV,ZEISS,,LENTE PRONTA,1.59,,DURAVISION,SILVER
LP17569,LT PRONTA ZEISS POLI INC CLEARVIEW DRV PLATINUM,ZEISS,,LENTE PRONTA,1.59,,DURAVISION,PLATINUM
LP17570,LT PRONTA ZEISS 1.60 INC CLEARVIEW DRV SILVER UV,ZEISS,,LENTE PRONTA,1.60,,DURAVISION,SILVER
LP17571,LP ZEISS 1.60 INC CLRVIEW DRV SILVER UV Cil. EST,ZEISS,,LENTE PRONTA,1.60,,DURAVISION,SILVER
LP17572,LT PRONTA ZEISS 1.60 INC CLEARVIEW DRV PLATINUM,ZEISS,,LENTE PRONTA,1.60,,DURAVISION,PLATINUM
LP17573,LP ZEISS 1.60 INC CLRVIEW PFUSION CNZ DRV PLATIN,ZEISS,,LENTE PRONTA,1.60,PHOTOFUSION,DURAVISION,PLATINUM
LP17574,LT PRONTA ZEISS 1.67 INC CLEARVIEW DRV SILVER UV,ZEISS,,LENTE PRONTA,1.67,,DURAVISION,SILVER
LP17575,LT PRONTA ZEISS 1.67 INC CLEARVIEW DRV PLATINUM,ZEISS,,LENTE PRONTA,1.67,,DURAVISION,PLATINUM
LP17576,LT PRONTA ZEISS 1.74 INC CLEARVIEW DRV PLATINUM,ZEISS,,LENTE PRONTA,1.74,,DURAVISION,PLATINUM
LP17842,LT PRONTA ZEISS 1.60 INC CLEARVIEW DRV CHROME UV,ZEISS,,LENTE PRONTA,1.60,,DURAVISION,CHROME
LP18900,LT PRONTA  STYLIS 1.74 INC CRZ SAPP HR,ESSILOR,,LENTE PRONTA,1.74,,CRIZAL,SAPPHIRE
LP18901,LT PRONTA STYLIS 1.67 BLUE UV SAPP HR,ESSILOR,,LENTE PRONTA,1.67,,CRIZAL,SAPPHIRE
LP18902,LT PRONTA AIR BLUE UV CRZ SAPPHIRE HR,ESSILOR,,LENTE PRONTA,1.59,,CRIZAL,SAPPHIRE
LP18904,LP ESSILOR ORMA TR8 CINZA CZ SAPPHIRE HR,ESSILOR,,LENTE PRONTA,1.50,TRANSITIONS,CRIZAL,SAPPHIRE
LP18906,LT PRONTA  ORMA INC CRZ ROCK,ESSILOR,,LENTE PRONTA,1.50,,CRIZAL,
LP2522,LT PRONTA CR-39 TRANS CINZA,ESSILOR,,LENTE PRONTA,1.50,TRANSITIONS,ANTIRRISCO,
LP2532,LT PRONTA MEDIO ÍNDICE 1.56 AR,1.56,,LENTE PRONTA,1.56,,AR,
LP2555,LT PRONTA SOLAR CR-39 C600 71 MM BLACK,CR-39,SOL,LENTE PRONTA,1.50,,ANTIRRISCO,
LP2556,LT PRONTA SOLAR CR-39 C600 71 MM CINZA,CR-39,SOL,LENTE PRONTA,1.50,,ANTIRRISCO,
LP2557,LT PRONTA SOLAR CR-39 C600 71 MM G-15,CR-39,SOL,LENTE PRONTA,1.50,,ANTIRRISCO,
LP2558,LT PRONTA SOLAR CR-39 C600 71 MM MARROM,CR-39,SOL,LENTE PRONTA,1.50,,ANTIRRISCO,
LP2559,LT PRONTA SOLAR CR-39 C600 76 MM BLACK,CR-39,SOL,LENTE PRONTA,1.50,,ANTIRRISCO,
LP2560,LT PRONTA SOLAR CR-39 C600 76 MM CINZA,CR-39,SOL,LENTE PRONTA,1.50,,ANTIRRISCO,
LP2561,LT PRONTA SOLAR CR-39 C600 76 MM G-15,CR-39,SOL,LENTE PRONTA,1.50,,ANTIRRISCO,
LP2562,LT PRONTA SOLAR CR-39 C600 76 MM MARROM,CR-39,SOL,LENTE PRONTA,1.50,,ANTIRRISCO,
LP2563,LT PRONTA SOLAR CR-39 C800 71 MM BLACK,CR-39,SOL,LENTE PRONTA,1.50,,ANTIRRISCO,
LP2564,LT PRONTA SOLAR CR-39 C800 71 MM CINZA,CR-39,SOL,LENTE PRONTA,1.50,,ANTIRRISCO,
LP2565,LT PRONTA SOLAR CR-39 C800 71 MM G-15,CR-39,SOL,LENTE PRONTA,1.50,,ANTIRRISCO,
LP2567,LT PRONTA SOLAR CR-39 C800 76 MM BLACK,CR-39,SOL,LENTE PRONTA,1.50,,ANTIRRISCO,
LP2568,LT PRONTA SOLAR CR-39 C800 76 MM CINZA,CR-39,SOL,LENTE PRONTA,1.50,,ANTIRRISCO,
LP2569,LT PRONTA SOLAR CR-39 C800 76 MM G-15,CR-39,SOL,LENTE PRONTA,1.50,,ANTIRRISCO,
LP2570,LT PRONTA SOLAR CR-39 C800 76 MM MARROM,CR-39,SOL,LENTE PRONTA,1.50,,ANTIRRISCO,
LP2571,LT PRONTA SOLAR POLI C600 CINZA,ZEISS,SOLAR,LENTE PRONTA,1.59,,ANTIRRISCO,
LP2572,LT PRONTA SOLAR POLI C600 G-15,POLI,SOL,LENTE PRONTA,1.59,,ANTIRRISCO,
LP2573,LT PRONTA SOLAR POLI C600 MARROM,POLI,SOL,LENTE PRONTA,1.59,,AR,
LP2574,LT PRONTA SOLAR POLI C800 CINZA,POLI,SOL,LENTE PRONTA,1.59,,ANTIRRISCO,
LP2575,LT PRONTA SOLAR POLI C800 G-15,POLI,SOL,LENTE PRONTA,1.59,,ANTIRRISCO,
LP2577,LT PRONTA SOLAR CR-39 C600 71 MM BLACK AR,CR-39,SOL,LENTE PRONTA,1.50,,AR,
LP2578,LT PRONTA SOLAR CR-39 C600 71 MM CINZA AR,CR-39,SOL,LENTE PRONTA,1.50,,AR,
LP2579,LT PRONTA SOLAR CR-39 C600 71 MM G-15 AR,CR-39,SOL,LENTE PRONTA,1.50,,AR,
LP2583,LT PRONTA SOLAR CR-39 C600 76 MM G-15 AR,CR-39,SOL,LENTE PRONTA,1.50,,AR,
LP2589,LT PRONTA SOLAR CR-39 C800 76 MM BLACK AR,CR-39,SOL,LENTE PRONTA,1.50,,AR,
LP2591,LT PRONTA SOLAR CR-39 C800 76 MM G-15 AR,ZEISS,SOLAR,LENTE PRONTA,1.50,,AR,
LP2592,LT PRONTA SOLAR CR-39 C800 76 MM MARROM AR,CR-39,SOL,LENTE PRONTA,1.50,,AR,
LP2596,LT PRONTA SOLAR POLI C800 CINZA AR,POLI,SOL,LENTE PRONTA,1.59,,AR,
LP2607,LT PRONTA THINHARD TRIVEX,THINHARD,,LENTE PRONTA,1.53,,ANTIRRISCO,
LP2613,LT PRONTA MIOLIGHT TRIVEX CLEANEXTRA,MIOLIGHT,,LENTE PRONTA,1.53,,CLEANEXTRA,
LP2614,LT PRONTA HIPERLIGHT TRIVEX CLEANEXTRA,HIPERLIGHT,,LENTE PRONTA,1.53,,CLEANEXTRA,
LP2617,LT PRONTA MIOLIGHT 1.67 NO-RISK,MIOLIGHT,,LENTE PRONTA,1.67,,NO-RISK,
LP2637,LENTES OFT CR-39 TRANS AR,ESSILOR,,VISÃO SIMPLES,1.50,TRANSITIONS,AR,
LP2658,LT PRONTA ULTRAX TRIVEX AQUA,ULTRAX,,LENTE PRONTA,1.53,,AQUA,
LP2659,LT PRONTA ULTRAX CR-39 AQUA,ULTRAX,,LENTE PRONTA,1.50,,AQUA,
LP2661,LT PRONTA THINHARD POLI INC.,THINHARD,,LENTE PRONTA,1.59,,ANTIRRISCO,
LP2697,LT PRONTA MIOLIGHT 1.74 LONGLIFE,MIOLIGHT,,LENTE PRONTA,1.74,,ANTIRRISCO,
LP2703,LT PRONTA ULTRAX POLI AQUA,ULTRAX,,LENTE PRONTA,1.59,,AQUA,
LP2704,LT PRONTA TRIVEX BLUE CONTROL,HOYA,,LENTE PRONTA,1.53,,BLUECONTROL,
LP2714,LT PRONTA ZEISS 1.50 ASP DRV PLATINUM,ZEISS,,LENTE PRONTA,1.50,,DURAVISION,PLATINUM
LP2717,LT PRONTA ZEISS 1.67 ASP DRV PLATINUM,ZEISS,,LENTE PRONTA,1.67,,DURAVISION,PLATINUM
LP2723,LT PRONTA ZEISS 1.74 ASP DRV PLATINUM,ZEISS,,LENTE PRONTA,1.74,,DURAVISION,PLATINUM
LP2727,LT PRONTA 1.67 AR,1.67,,LENTE PRONTA,1.67,,AR,
LP30002,LT PRONTA ULTRAX CR-39 SENSITY CLEANEXTRA,ULTRAX,,LENTE PRONTA,1.50,SENSITY,CLEANEXTRA,
LP30003,LT PRONTA 1.61 AR,1.61,,LENTE PRONTA,1.60,,AR,
LP30004,LT PRONTA 1.61 AR (CIL.ESTENDIDO),1.61,,LENTE PRONTA,1.60,,AR,
LP30005,LENTE PRONTA MÉDIO ÍNDICE 1.56 AR CIL ESTENDIDO,1.56,,LENTE PRONTA,1.56,,AR,
LP30006,LT PRONTA 1.67 AR (CIL. ESTENDIDO),1.67,,LENTE PRONTA,1.67,,AR,
LP30007,LT PRONTA 1.74 AR,1.74,,LENTE PRONTA,1.74,,AR,
LP30045,LT PRONTA HOYA PREMIUM 1.50 BCONTROL,HOYA,PREMIUM,LENTE PRONTA,1.50,,BLUECONTROL,
LP30849,LT PRT 1.50 CLEARVIEW PFSN X CNZ DRV PLATINUM,ZEISS,,LENTE PRONTA,1.50,PHOTOFUSION,DURAVISION,PLATINUM
LP30850,LT PRT 1.60 CLEARVIEW PFSN X CNZ DRV PLATINUM,ZEISS,,LENTE PRONTA,1.60,PHOTOFUSION,DURAVISION,PLATINUM
LSA0000120,VS RAY BAN EQUA 1.59 POL VERDE G15 AR PREMIUM UV,RAY BAN,EQUALIZED,VISÃO SIMPLES,1.59,,AR,
LSA0000121,VS RAY BAN EQUA 1.59 POL MRM B15 AR PREMIUM UV,RAY BAN,EQUALIZED,VISÃO SIMPLES,1.59,,AR,
LSA0000128,VS RAY BAN EQUA 1.59 COLOR VERDE G15 AR PREMIUM UV,RAY BAN,EQUALIZED,VISÃO SIMPLES,1.59,,AR,
LSA0000129,VS RAY BAN EQUA 1.59 COLOR MRM B15 AR PREMIUM UV,RAY BAN,EQUALIZED,VISÃO SIMPLES,1.59,,AR,
LSA0000130,PR RAY BAN BASE 1.59 POL VRD G15 AR PREMIUM UV,RAY BAN,BASE,PROGRESSIVA,1.59,,AR,
LSA0000135,PR RAY BAN BASE 1.59 POL AZUL DGRD AR PREMIUM UV,RAY BAN,BASE,PROGRESSIVA,1.59,,AR,
LSA0000138,PR RAY BAN BASE 1.59 COLOR VERDE G15 AR PREMIUM UV,RAY BAN,BASE,PROGRESSIVA,1.59,,AR,
LSA0000140,VS RAY BAN EQUALIZED 1.59 COLOR AZUL AR PREMIUM UV,RAY BAN,EQUALIZED,VISÃO SIMPLES,1.59,,AR,
LSA0000141,PR RAY BAN BASE 1.59 COLOR AZUL AR PREMIUM UV,RAY BAN,BASE,PROGRESSIVA,1.59,,AR,
LSA0000620,VS RAY BAN EQUA FLAT 1.59 VERDE G15 AR PRMM UV,RAY BAN,EQUALIZED,VISÃO SIMPLES,1.59,,AR,
LSA0000622,VS RAY BAN EQUA FLAT 1.59 COLOR AZUL AR PREMIUM UV,RAY BAN,EQUALIZED,VISÃO SIMPLES,1.59,,AR,
LSA0001129,VS ZEISS 1.50 INC ANTIRRISCO,ZEISS,FREEFORM,VISÃO SIMPLES,1.50,,ANTIRRISCO,
LSA0001130,VS ZEISS 1.50 INC BLUE PROTECT UV,ZEISS,,VISÃO SIMPLES,1.50,,DURAVISION,BLUEPROTECT
LSA0001131,VS ZEISS 1.50 INC DURAVISION CHROME UV,ZEISS,FREEFORM,VISÃO SIMPLES,1.50,,DURAVISION,CHROME
LSA0001149,VS ZEISS 1.50 PFSN CNZ BLUE PROTECT UV,ZEISS,,VISÃO SIMPLES,1.50,PHOTOFUSION,DURAVISION,BLUEPROTECT
LSA0001152,VS ZEISS 1.50 PFUSION CNZ DRV CHROME UV,ZEISS,FREEFORM,VISÃO SIMPLES,1.50,PHOTOFUSION,DURAVISION,CHROME
LSA0001156,VS ZEISS 1.50 PFUSION CNZ DRV SILVER UV,ZEISS,FREEFORM,VISÃO SIMPLES,1.50,PHOTOFUSION,DURAVISION,SILVER
LSA0001160,VS ZEISS 1.60 AS INC BLUE PROTECT UV,ZEISS,,VISÃO SIMPLES,1.60,,DURAVISION,BLUEPROTECT
LSA0001161,VS ZEISS 1.60 AS INC DRV CHROME UV,ZEISS,FREEFORM,VISÃO SIMPLES,1.60,,DURAVISION,CHROME
LSA0001168,VS ZEISS 1.67 AS PFUSION DRV CHROME UV,ZEISS,FREEFORM,VISÃO SIMPLES,1.67,PHOTOFUSION,DURAVISION,CHROME
LSA0001176,VS ZEISS POLI INC BLUE PROTECT UV,ZEISS,,VISÃO SIMPLES,1.59,,DURAVISION,BLUEPROTECT
LSA0001177,VS ZEISS 1.67 AS INC BLUE PROTECT UV,ZEISS,,VISÃO SIMPLES,1.67,,DURAVISION,BLUEPROTECT
LSA0001184,VS ZEISS 1.67 AS INC DRV SILVER UV,ZEISS,FREEFORM,VISÃO SIMPLES,1.67,,DURAVISION,SILVER
LSA0001185,VS ZEISS 1.67 AS PFUSION BLUE PROTECT UV,ZEISS,,VISÃO SIMPLES,1.67,PHOTOFUSION,DURAVISION,BLUEPROTECT
LSA0001188,VS ZEISS POLI INC DURAVISION CHROME UV,ZEISS,FREEFORM,VISÃO SIMPLES,1.59,,DURAVISION,CHROME
LSA0001189,VS ZEISS POLI INC DURAVISION PLATINUM UV,ZEISS,FREEFORM,VISÃO SIMPLES,1.59,,DURAVISION,PLATINUM
LSA0001196,VS ZEISS POLI PFUSION DRV CHROME UV,ZEISS,FREEFORM,VISÃO SIMPLES,1.59,PHOTOFUSION,DURAVISION,CHROME
LSA0001200,VS ZEISS POLI PFUSION DRV SILVER UV,ZEISS,FREEFORM,VISÃO SIMPLES,1.59,PHOTOFUSION,DURAVISION,SILVER
LSA0001217,VS POLI COLOR PADRÃO DEGRADE ANTIRRISCO,POLI,,VISÃO SIMPLES,1.59,,ANTIRRISCO,
LSA0001225,VS CR-39 COLOR ESPECIAL - CHAVE 1 ANTIRRISCO,CR-39,,VISÃO SIMPLES,1.50,,ANTIRRISCO,
LSA0001229,VS CR-39 COLOR ESPECIAL - CHAVE 2,CR-39,,VISÃO SIMPLES,1.50,,ANTIRRISCO,
LSA0001235,VS CR-39 COLOR ESPECIAL 76 mm,CR-39,,VISÃO SIMPLES,1.50,,ANTIRRISCO,
LSA0001239,VS CR-39 COLOR PADRÃO TOTAL- CHAVE 1 ANTIRRISCO,CR-39,,VISÃO SIMPLES,1.50,,ANTIRRISCO,
LSA0001242,VS CR-39 COLOR PADRÃO TOTAL - CHAVE 1 AR,CR-39,,VISÃO SIMPLES,1.50,,AR,
LSA0001243,VS CR-39 COLOR PADRÃO TOTAL - CHAVE 2,CR-39,,VISÃO SIMPLES,1.50,,ANTIRRISCO,
LSA0001247,VS CR-39 COLOR PADRÃO TOTAL 76 mm,CR-39,,VISÃO SIMPLES,1.50,,ANTIRRISCO,
LSA0002045,VS RAY BAN AMPLIFIED 1.59 VERDE G15 AR PRMM UV,RAY BAN,AMPLIFIED,VISÃO SIMPLES,1.59,,AR,
LSA0002051,VS RAY BAN AMPLIFIED 1.59 POL VERDE G15 AR PRMM UV,RAY BAN,AMPLIFIED,VISÃO SIMPLES,1.59,,AR,
LSA0002056,VS RAY BAN AMPLIFIED 1.59 POL AZUL DGRD AR PRMM UV,RAY BAN,AMPLIFIED,VISÃO SIMPLES,1.59,,AR,
LSA0002057,VS RAY BAN AMPLIFIED 1.59 POL CNZ DGRD AR PRMM UV,RAY BAN,AMPLIFIED,VISÃO SIMPLES,1.59,,AR,
LSA0002061,PR RAY BAN EQUA 1.59 15 COLOR VERDE G15 AR PRMM UV,RAY BAN,EQUALIZED,PROGRESSIVA,1.59,,AR,
LSA0002062,PR RAY BAN EQUA 1.59 18 COLOR VERDE G15 AR PRMM UV,RAY BAN,EQUALIZED,PROGRESSIVA,1.59,,AR,
LSA0002074,PR RAY BAN EQUA 1.59 18 POL VERDE G15 AR PRMM UV,RAY BAN,EQUALIZED,PROGRESSIVA,1.59,,AR,
LSA0002083,PR RAY BAN EQUA 1.59 15 POL AZUL DGRD AR PRMM UV,RAY BAN,EQUALIZED,PROGRESSIVA,1.59,,AR,
LSA0002085,PR RAY BAN EQUA 1.59 15 POL CNZ DGRD AR PRMM UV,RAY BAN,EQUALIZED,PROGRESSIVA,1.59,,AR,
LSA0002634,VS CR-39 INC - CHAVE 1 ANTIRRISCO,CR-39,,VISÃO SIMPLES,1.50,,ANTIRRISCO,
LSA0002635,VS CR-39 INC - CHAVE 1 AR,CR-39,,VISÃO SIMPLES,1.50,,AR,
LSA0002636,VS CR-39 INC - CHAVE 2 ANTIRRISCO,CR-39,,VISÃO SIMPLES,1.50,,ANTIRRISCO,
LSA0002637,VS CR-39 INC - CHAVE 2 AR,CR-39,,VISÃO SIMPLES,1.50,,AR,
LSA0002638,VS CR-39 INC 76 mm ANTIRRISCO,CR-39,,VISÃO SIMPLES,1.50,,ANTIRRISCO,
LSA0002639,VS CR-39 INC 76 mm AR,CR-39,,VISÃO SIMPLES,1.50,,AR,
LSA0002640,VS CR-39 TRANS CNZ ANTIRRISCO,CR-39,,VISÃO SIMPLES,1.50,TRANSITIONS,ANTIRRISCO,
LSA0002641,VS CR-39 TRANS CNZ AR,CR-39,,VISÃO SIMPLES,1.50,TRANSITIONS,AR,
LSA0002648,VS POLI COLOR PADRÃO TOTAL ANTIRRISCO,POLI,,VISÃO SIMPLES,1.59,,ANTIRRISCO,
LSA0002667,LT PRONTA CR-39 COLOR PADRÃO DEGRADE,CR-39,,LENTE PRONTA,1.50,,ANTIRRISCO,
LSA0002668,VS CR-39 COLOR PADRÃO DEGRADE - CHAVE 1 ANTIRRISCO,CR-39,,VISÃO SIMPLES,1.50,,ANTIRRISCO,
LSA0002670,VS CR-39 COLOR PADRÃO DEGRADE - CHAVE 2,CR-39,,VISÃO SIMPLES,1.50,,ANTIRRISCO,
LSA0002681,VS CR-39 COLOR PADRÃO DEGRADE 76 mm,CR-39,,VISÃO SIMPLES,1.50,,ANTIRRISCO,
LSA0002836,LT PRONTA CR-39 COLOR ESPECIAL,CR-39,,LENTE PRONTA,1.50,,ANTIRRISCO,
LSA0002837,LT PRONTA CR-39 COLOR PADRÃO TOTAL,CR-39,,LENTE PRONTA,1.50,,ANTIRRISCO,
LSA0002838,LT PRONTA CR-39 INC,CR-39,,LENTE PRONTA,1.50,,ANTIRRISCO,
LSA0002840,LT PRONTA CR-39 INC AR,CR-39,,LENTE PRONTA,1.50,,AR,
LSA0002841,LT PRONTA ESSILOR AIRWEAR CZ EASY UV,ESSILOR,,LENTE PRONTA,1.59,,CRIZAL,EASY
LSA0002842,LT PRONTA ESSILOR AIRWEAR E-SPF 35 FORTE,ESSILOR,,LENTE PRONTA,1.59,,CRIZAL,
LSA0002843,LT PRONTA ESSILOR AIRWEAR SAPPHIRE,ESSILOR,,LENTE PRONTA,1.59,,CRIZAL,SAPPHIRE
LSA0002845,LT PRONTA ESSILOR ORMA CZ EASY UV,ESSILOR,,LENTE PRONTA,1.50,,CRIZAL,EASY
LSA0002846,LT PRONTA ESSILOR ORMA E-SPF 35 FORTE,ESSILOR,,LENTE PRONTA,1.50,,CRIZAL,
LSA0002847,LT PRONTA ESSILOR ORMA OPTIFOG,ESSILOR,,LENTE PRONTA,1.50,,OPTIFOG,
LSA0002848,LT PRONTA ESSILOR ORMA PREVENCIA,ESSILOR,,LENTE PRONTA,1.50,,CRIZAL,PREVENCIA
LSA0002849,LT PRONTA ESSILOR ORMA SAPPHIRE,ESSILOR,,LENTE PRONTA,1.50,,CRIZAL,SAPPHIRE
LSA0002852,LP ORMA EASY CLEAN,ESSILOR,,LENTE PRONTA,1.50,,EASY CLEAN,
LSA0002853,LT PRONTA ESSILOR STYLIS 1.67 E-SPF 35 FORTE,ESSILOR,,LENTE PRONTA,1.67,,CRIZAL,
LSA0002854,LT PRONTA ESSILOR STYLIS 1.67 SAPPHIRE,ESSILOR,,LENTE PRONTA,1.67,,CRIZAL,SAPPHIRE
LSA0002855,LT PRONTA ESSILOR STYLIS 1.74 SAPPHIRE,ESSILOR,,LENTE PRONTA,1.74,,CRIZAL,SAPPHIRE
LSA0002856,LT PRONTA KODAK 1.50 NO REFLEX,KODAK,NO REFLEX,LENTE PRONTA,1.50,,NO REFLEX,
LSA0002858,LT PRONTA KODAK 1.67 NO REFLEX,KODAK,NO REFLEX,LENTE PRONTA,1.67,,NO REFLEX,
LSA0002859,LT PRONTA KODAK POLI NO REFLEX,KODAK,NO REFLEX,LENTE PRONTA,1.59,,NO REFLEX,
LSA0002861,LT PRONTA POLI INC,ESSILOR,,LENTE PRONTA,1.59,,ANTIRRISCO,
LSA0002862,LT PRONTA POLI INC AR,ESSILOR,,LENTE PRONTA,1.59,,AR,
LSA0002863,LT PRONTA POLI INC AR (CIL. ESTENDIDO),POLI,AR,LENTE PRONTA,1.59,,AR,
LSA0002872,LT PRONTA SUPERMAX 1.50 SENSITIVE CNZ AR,SUPERMAX,,LENTE PRONTA,1.50,SENSITIVE,AR,
LSA0002873,LT PRONTA SUPERMAX 1.56 INC AR,SUPERMAX,,LENTE PRONTA,1.56,,AR,
LSA0002875,LT PRONTA SUPERMAX 1.61 INC AR,SUPERMAX,,LENTE PRONTA,1.60,,AR,
LSA0002877,LT PRONTA SUPERMAX 1.67 INC AR,SUPERMAX,,LENTE PRONTA,1.67,,AR,
LSA0002879,LT PRONTA SUPERMAX 1.74 INC AR,SUPERMAX,,LENTE PRONTA,1.74,,AR,
LSA0002880,LT PRONTA SUPERMAX 1.56 BLUE CUT AR,SUPERMAX,,LENTE PRONTA,1.56,,BLUE CUT,
LSA0002881,LT PRONTA SUPERMAX 1.61 BLUE CUT AR,SUPERMAX,,LENTE PRONTA,1.60,,BLUE CUT,
LSA0002882,LT PRONTA SUPERMAX 1.67 BLUE CUT AR,SUPERMAX,,LENTE PRONTA,1.67,,BLUE CUT,
LSA0002883,LT PRONTA SUPERMAX LIGHT 1.56 SENSITIVE CNZ AR,SUPERMAX,LIGHT,LENTE PRONTA,1.56,SENSITIVE,AR,
LSA0002884,LT PRONTA SUPERMAX PLUS 1.56 INC AR,SUPERMAX,PLUS,LENTE PRONTA,1.56,,AR,
LSA0002886,LT PRONTA SUPERMAX PLUS 1.61 INC AR,SUPERMAX,PLUS,LENTE PRONTA,1.60,,AR,
LSA0002888,LT PRONTA SUPERMAX PLUS 1.67 INC AR,SUPERMAX,PLUS,LENTE PRONTA,1.67,,AR,
LSA0002890,LT PRONTA SUPERMAX PLUS 1.74 INC AR,SUPERMAX,PLUS,LENTE PRONTA,1.74,,AR,
LSA0002892,LT PRONTA SUPERMAX PLUS POLI INC AR,SUPERMAX,PLUS,LENTE PRONTA,1.59,,AR,
LSA0002894,LT PRONTA SUPERMAX POLI INC AR,SUPERMAX,,LENTE PRONTA,1.59,,AR,
LSA0002896,LT PRONTA SUPERMAX POLI BLUE CUT AR,SUPERMAX,,LENTE PRONTA,1.59,,BLUE CUT,
LSA0002898,LT PRONTA ZEISS 1.50 ASP DURAVISION BLUEPROTECT UV,ZEISS,,LENTE PRONTA,1.50,,DURAVISION,BLUEPROTECT
LSA0002899,LT PRONTA ZEISS 1.50 ASP DURAVISION CHROME UV,ZEISS,,LENTE PRONTA,1.50,,DURAVISION,CHROME
LSA0002900,LT PRONTA ZEISS 1.50 ASP DURAVISION PLATINUM UV,ZEISS,,LENTE PRONTA,1.50,,DURAVISION,PLATINUM
LSA0002901,LT PRONTA ZEISS 1.50 ASP DURAVISION SILVER UV,ZEISS,,LENTE PRONTA,1.50,,DURAVISION,SILVER
LSA0002903,LT PRONTA ZEISS 1.60 ASP DURAVISION BLUEPROTECT UV,ZEISS,,LENTE PRONTA,1.60,,DURAVISION,BLUEPROTECT
LSA0002904,LT PRONTA ZEISS 1.60 ASP DURAVISION PLATINUM UV,ZEISS,,LENTE PRONTA,1.60,,DURAVISION,PLATINUM
LSA0002905,LT PRONTA ZEISS 1.60 ASP DURAVISION SILVER UV,ZEISS,,LENTE PRONTA,1.60,,DURAVISION,SILVER
LSA0002906,LT PRONTA ZEISS 1.67 ASP DURAVISION BLUEPROTECT UV,ZEISS,,LENTE PRONTA,1.67,,DURAVISION,BLUEPROTECT
LSA0002907,LT PRONTA ZEISS 1.67 ASP DURAVISION PLATINUM UV,ZEISS,,LENTE PRONTA,1.67,,DURAVISION,PLATINUM
LSA0002908,LT PRONTA ZEISS 1.67 ASP DURAVISION SILVER UV,ZEISS,,LENTE PRONTA,1.67,,DURAVISION,SILVER
LSA0002909,LT PRONTA ZEISS 1.74 ASP DURAVISION PLATINUM UV,ZEISS,,LENTE PRONTA,1.74,,DURAVISION,PLATINUM
LSA0002910,LT PRONTA ZEISS POLI ASP DURAVISION BLUEPROTECT UV,ZEISS,,LENTE PRONTA,1.59,,DURAVISION,BLUEPROTECT
LSA0002911,LT PRONTA ZEISS POLI ASP DURAVISION CHROME UV,ZEISS,,LENTE PRONTA,1.59,,DURAVISION,CHROME
LSA0002912,LT PRONTA ZEISS POLI ASP DURAVISION PLATINUM UV,ZEISS,,LENTE PRONTA,1.59,,DURAVISION,PLATINUM
LSA0002913,LT PRONTA ZEISS POLI ASP DURAVISION SILVER UV,ZEISS,,LENTE PRONTA,1.59,,DURAVISION,SILVER
LSA0002922,PR FREEMAX SOFT 1.67 INC FILTRO AZUL CLEAR UV,FREEMAX,,PROGRESSIVA,1.67,,CLEAR UV,
LSA0002923,PR FREEMAX SOFT 1.67 INC FILTRO AZUL CLEARPLUS,FREEMAX,,PROGRESSIVA,1.67,,CLEARPLUS,
LSA0002961,PR GLOBAL LUX HD 1.50 FILTRO AZUL ANTIRRISCO,GLOBAL LUX,,PROGRESSIVA,1.50,,ANTIRRISCO,
LSA0002962,PROG GLOBAL LUX HD 1.50 BLUE FILTER CLEAR UV,GLOBAL LUX,,PROGRESSIVA,1.50,,CLEAR UV,
LSA0002963,PR GLOBAL LUX HD 1.50 INC FILTRO AZUL CLEAR UV,GLOBAL LUX,,PROGRESSIVA,1.50,,CLEAR UV,
LSA0002964,PR GLOBAL LUX HD 1.50 INC FILTRO AZUL CLEARPLUS,GLOBAL LUX,,PROGRESSIVA,1.50,,CLEARPLUS,
LSA0002965,PR GLOBAL LUX HD 1.50 COLOR PADRÃO TOTAL,GLOBAL LUX,,PROGRESSIVA,1.50,,ANTIRRISCO,
LSA0002966,PR GLOBAL LUX HD 1.50 INC RESISTENTE A RISCO,GLOBAL LUX,,PROGRESSIVA,1.50,,ANTIRRISCO,
LSA0002967,PROG GLOBAL LUX HD 1.50 INCOLOR CLEAR UV,GLOBAL LUX,,PROGRESSIVA,1.50,,CLEAR UV,
LSA0002968,PR GLOBAL LUX HD 1.50 INC CLEAR UV (RES. VRD),GLOBAL LUX,,PROGRESSIVA,1.50,,CLEAR UV,
LSA0002969,PR GLOBAL LUX HD 1.50 INC CLEARPLUS (RES. AZUL),GLOBAL LUX,,PROGRESSIVA,1.50,,CLEARPLUS,
LSA0002970,PR GLOBAL LUX HD 1.50 SENSITIVE CNZ ANTIRRISCO,GLOBAL LUX,,PROGRESSIVA,1.50,SENSITIVE,ANTIRRISCO,
LSA0002972,PR GLOBAL LUX HD 1.50 SENSITIVE CNZ CLEAR UV,GLOBAL LUX,,PROGRESSIVA,1.50,SENSITIVE,CLEAR UV,
LSA0002973,PR GLOBAL LUX HD 1.50 SENSITIVE CNZ CLEARPLUS,GLOBAL LUX,,PROGRESSIVA,1.50,SENSITIVE,CLEARPLUS,
LSA0002974,PR GLOBAL LUX HD POLI FILTRO AZUL ANTIRRISCO,GLOBAL LUX,,PROGRESSIVA,1.59,,ANTIRRISCO,
LSA0002976,PR GLOBAL LUX HD POLI INC FILTRO AZUL CLEAR UV,GLOBAL LUX,,PROGRESSIVA,1.59,,CLEAR UV,
LSA0002977,PR GLOBAL LUX HD POLI INC FILTRO AZUL CLEARPLUS,GLOBAL LUX,,PROGRESSIVA,1.59,,CLEARPLUS,
LSA0002978,PR GLOBAL LUX HD POLI COLOR PADRÃO TOTAL,GLOBAL LUX,,PROGRESSIVA,1.59,,ANTIRRISCO,
LSA0002979,PR GLOBAL LUX HD POLI INC RESISTENTE A RISCO,GLOBAL LUX,,PROGRESSIVA,1.59,,ANTIRRISCO,
LSA0002981,PR GLOBAL LUX HD POLI INC CLEAR UV (RES. VRD),GLOBAL LUX,,PROGRESSIVA,1.59,,CLEAR UV,
LSA0002982,PR GLOBAL LUX HD POLI INC CLEARPLUS (RES. AZUL),GLOBAL LUX,,PROGRESSIVA,1.59,,CLEARPLUS,
LSA0002983,PR GLOBAL LUX HD POLI SENSITIVE CNZ ANTIRRISCO,GLOBAL LUX,,PROGRESSIVA,1.59,SENSITIVE,ANTIRRISCO,
LSA0002985,PR GLOBAL LUX HD POLI SENSITIVE CNZ CLEAR UV,GLOBAL LUX,,PROGRESSIVA,1.59,SENSITIVE,CLEAR UV,
LSA0002986,PR GLOBAL LUX HD POLI SENSITIVE CNZ CLEARPLUS,GLOBAL LUX,,PROGRESSIVA,1.59,SENSITIVE,CLEARPLUS,
LSA0002988,PR GT2 FF 1.67 PFUSION CNZ DURAVISION CHROME UV,GT2,FREEFORM,PROGRESSIVA,1.67,PHOTOFUSION,DURAVISION,CHROME
LSA0002989,PR GT2 FF 1.67 PFUSION CNZ DURAVISION PLATINUM UV,GT2,FREEFORM,PROGRESSIVA,1.67,PHOTOFUSION,DURAVISION,PLATINUM
LSA0002990,PR GT2 FF 1.67 PFUSION CNZ DURAVISION SILVER UV,GT2,FREEFORM,PROGRESSIVA,1.67,PHOTOFUSION,DURAVISION,SILVER
LSA0002995,PR GT2 FF POLI INC DURAVISION CHROME UV,GT2,FREEFORM,PROGRESSIVA,1.59,,DURAVISION,CHROME
LSA0003042,PR LUXFOCAL SMART HD 1.67 INC FILTRO AZUL CLEAR UV,LUXFOCAL,SMART HD,PROGRESSIVA,1.67,,CLEAR UV,
LSA0003043,PR LUXFOCAL SMART HD 1.67 FILTRO AZUL CLEARPLUS,LUXFOCAL,SMART HD,PROGRESSIVA,1.67,,CLEARPLUS,
LSA0003051,PR LUXFOCAL SMART HD 1.67 INC CLEARPLUS,LUXFOCAL,SMART HD,PROGRESSIVA,1.67,,CLEARPLUS,
LSA0003068,PR LUXFOCAL SMART HD 1.50 INC CLEARBLUE,LUXFOCAL,SMART HD,PROGRESSIVA,1.50,,CLEARBLUE,
LSA0003069,PR LUXFOCAL SMART HD 1.50 INC CLEARPLUS,LUXFOCAL,SMART HD,PROGRESSIVA,1.50,,CLEARPLUS,
LSA0003079,PR LUXFOCAL SMART HD 1.50 SENSITIVE CNZ CLEARBLUE,LUXFOCAL,SMART HD,PROGRESSIVA,1.50,SENSITIVE,CLEARBLUE,
LSA0003164,PR MULTIMAX HD 1.50 INC INC FILTRO AZUL ANTIRRISCO,MULTIMAX,HD,PROGRESSIVA,1.50,,ANTIRRISCO,
LSA0003166,PR MULTIMAX HD 1.50 INC FILTRO AZUL CLEAR UV,MULTIMAX,HD,PROGRESSIVA,1.50,,CLEAR UV,
LSA0003167,PR MULTIMAX HD 1.50 INC FILTRO AZUL CLEARPLUS,MULTIMAX,HD,PROGRESSIVA,1.50,,CLEARPLUS,
LSA0003169,PR MULTIMAX HD 1.50 COLOR PADRÃO TOTAL AR,MULTIMAX,HD,PROGRESSIVA,1.50,,AR,
LSA0003171,PR MULTIMAX HD 1.50 INC CLEAR UV (RES. VRD),MULTIMAX,HD,PROGRESSIVA,1.50,,CLEAR UV,
LSA0003172,PR MULTIMAX HD 1.50 INC CLEARPLUS (RES. AZUL),MULTIMAX,HD,PROGRESSIVA,1.50,,CLEARPLUS,
LSA0003173,PR MULTIMAX HD 1.50 SENSITIVE CNZ ANTIRRISCO,MULTIMAX,HD,PROGRESSIVA,1.50,SENSITIVE,ANTIRRISCO,
LSA0003175,PR MULTIMAX HD 1.50 SENSITIVE CNZ CLEAR UV,MULTIMAX,HD,PROGRESSIVA,1.50,SENSITIVE,CLEAR UV,
LSA0003176,PR MULTIMAX HD 1.50 SENSITIVE CNZ CLEARPLUS,MULTIMAX,HD,PROGRESSIVA,1.50,SENSITIVE,CLEARPLUS,
LSA0003180,PR MULTIMAX HD POLI INC FILTRO AZUL CLEARPLUS,MULTIMAX,HD,PROGRESSIVA,1.59,,CLEARPLUS,
LSA0003184,PR MULTIMAX HD POLI INC CLEAR UV (RES. VRD),MULTIMAX,HD,PROGRESSIVA,1.59,,CLEAR UV,
LSA0003185,PR MULTIMAX HD POLI INC CLEARPLUS (RES. AZUL),MULTIMAX,HD,PROGRESSIVA,1.59,,CLEARPLUS,
LSA0003186,PR MULTIMAX HD POLI SENSITIVE CNZ ANTIRRISCO,MULTIMAX,HD,PROGRESSIVA,1.59,SENSITIVE,ANTIRRISCO,
LSA0003188,PR MULTIMAX HD POLI SENSITIVE CNZ CLEAR UV,MULTIMAX,HD,PROGRESSIVA,1.59,SENSITIVE,CLEAR UV,
LSA0003189,PR MULTIMAX HD POLI SENSITIVE CNZ CLEARPLUS,MULTIMAX,HD,PROGRESSIVA,1.59,SENSITIVE,CLEARPLUS,
LSA0003220,"REGR. MULTIMAX HD PRO 1.50 INC CLEAR UV 1,0",MULTIMAX,HD,REGRESSIVA,1.50,,CLEAR UV,
LSA0003222,"REGR. MULTIMAX HD PRO 1.50 INC CLEARPLUS 1,0",MULTIMAX,HD,REGRESSIVA,1.50,,CLEARPLUS,
LSA0003230,"REGR. MULTIMAX HD PRO POLI INC CLEARPLUS 1,0",MULTIMAX,HD,REGRESSIVA,1.59,,CLEARPLUS,
LSA0003232,VS SUPERMAX DIG. 1.50 INC FILTRO AZUL CLEAR UV,SUPERMAX,DIGITAL,VISÃO SIMPLES,1.50,,CLEAR UV,
LSA0003233,VS SUPERMAX DIG. 1.50 INC FILTRO AZUL CLEARPLUS,SUPERMAX,DIGITAL,VISÃO SIMPLES,1.50,,CLEARPLUS,
LSA0003234,VS SUPERMAX DIG. 1.50 COLOR ESPECIAL (C/AMOSTRA),SUPERMAX,DIGITAL,VISÃO SIMPLES,1.50,,ANTIRRISCO,
